{
        "version": "2",
        "product_name": "NIOT-E-NFL90-Q2N16-N",
        "serial_number": "20000",
        "product_number": "1320400",
        "date_code": "2020-12-16 13:00:49",
        "processor_serial_number": "0000000000020038",
        "mac": "0001C027D5DB",
        "cifx": {
                "device_number": "7690103",
                "serial_number": "23276",
                "revision_number": "4",
                "mac": "0002A260B8D4",
                "date_code": "5160"
        },
        "wifi": {
                "mac": "0"
        },
        "bluetooth": {
                "mac": "0"
        },
        "oem_data": {
        "identification": {
            "variant": "EVAL",
            "product_number": "",
            "serial_number": "",
            "product_name": "sensorEDGE",
            "equipment_id": "6175F2CE5A80"
        },
        "iotedge": {
            "method": "symmetric_key",
            "registration_id": "12345678",
            "scope_id": "12345678",
            "symmetric_key": "12345678"
        },
        "branding": {
            "version": "1.0.0",
            "deviceManager": {
                "enabledPlugins": ["plugin-name-a"],
                "disabledPlugins": ["plugin-name-b"],
                "remoteAccess": "on"
            },
            "services": {
                "deviceManager": {
                    "httpsPort": 443,
                    "httpPort": 80
                },
                "ssh": {
                    "enabled": true,
                    "port": 22
                },
                "docker": {
                    "enabled": false
                }
            },
            "ntp" : {
                "enabled": true,
                "timezone": "UTC",
                "servers": ["1.2.3.4", "de.ntp.pool.org"]
            },
            "interfaces": [{
                "name": "eth0",
                "mode": "auto",
                "address": "120.0.0.1/24",
                "dns": ["1.1.1.1"],
                "gateway": "120.0.0.255",
                "metric": 100,
                "routes": [{
                    "address": "121.0.0.1/24",
                    "gateway": "120.0.0.255",
                    "metric": 50
                }]
            }],
            "proxy": {
                "http": {
                    "host": "120.0.0.50:8080",
                    "username": "",
                    "password": ""
                },
                "https": {
                    "host": "120.0.0.50:8443",
                    "username": "",
                    "password": ""
                },
                "ftp": {
                    "host": "120.0.0.50:8021",
                    "username": "",
                    "password": ""
                }
            },
            "netFieldCloud": {
                "defaultMode": 0,
                "modeOptions": ["manual", "advanced", "zeroTouch"],
                "defaultInstance": 0,
                "instanceOptions": [{
                    "name": "Production",
                    "host": "api.netfield.io"
                }],
                "upstreamProtocol": "AMQPWS"
            },
            "users": [
                {
                    "name": "my_super_admin",
                    "mode": "add",
                    "shell": "/bin/zsh",
                    "additionalGroups": ["sudo", "docker"],
                    "password": "$6$tsTQ1XOmu23ctGtt$SFRKDyuVl01Hnls.oCripu5zXLrNJ1ZbkJ1s2NAJrEf6n7F099OWbVOfSIqUubSqeME1J9P8taJ/MM8zM3hDB0",
                    "forcePasswordChange": true
                },
                {
                    "name": "dont_need_user",
                    "mode" : "delete"
                },
                {   "name": "admin",
                    "mode" : "change",
                    "password": "$6$tsTQ1XOmu23ctGtt$SFRKDyuVl01Hnls.oCripu5zXLrNJ1ZbkJ1s2NAJrEf6n7F099OWbVOfSIqUubSqeME1J9P8taJ/MM8zM3hDB0",
                    "forcePasswordChange": true
                }
            ]
        }
    }
}
